Название товара,Цена,Ссылка на карточку товара
Подвесной светильник Сансет Black,3190,https://www.divan.ru/product/podvesnoj-svetilnik-sanset-black
Подвесной светильник Сансет White,3190,https://www.divan.ru/product/podvesnoj-svetilnik-sanset-white
Подвесной светильник Портланд Black,3290,https://www.divan.ru/product/podvesnoj-svetilnik-portland-black
Подвесной светильник Кая White,2590,https://www.divan.ru/product/podvesnoj-svetilnik-kaya-white
Подвесной светильник Кая Black,2590,https://www.divan.ru/product/podvesnoj-svetilnik-kaya-black
Подвесной светильник Кэндел Black,2690,https://www.divan.ru/product/podvesnoj-svetilnik-kendel-black
Подвесной светильник Кэндел White,1990,https://www.divan.ru/product/podvesnoj-svetilnik-kendel-white
Подвесной светильник Бабл-3,6190,https://www.divan.ru/product/podvesnoj-svetilnik-babl-3
Подвесной светильник Бабл-9,15990,https://www.divan.ru/product/podvesnoj-svetilnik-babl-9
Подвесной светильник Эдли Beige,29690,https://www.divan.ru/product/podvesnoj-svetilnik-edli-beige
Подвесной светильник Клифс Beige,13190,https://www.divan.ru/product/podvesnoj-svetilnik-klifs-beige
Подвесной светильник Корниш Beige,13190,https://www.divan.ru/product/podvesnoj-svetilnik-kornish-beige
Подвесной светильник Даклин White,3890,https://www.divan.ru/product/podvesnoj-svetilnik-daklin-white
Подвесной светильник Moderli Alina,9490,https://www.divan.ru/product/podvesnoj-svetilnik-moderli-alina
Подвесной светильник Priddy,9890,https://www.divan.ru/product/podvesnoj-svetilnik-priddy
Подвесной светильник Маро Green,11690,https://www.divan.ru/product/podvesnoj-svetilnik-maro-green
Подвесной светильник Кэнди Red,3990,https://www.divan.ru/product/podvesnoj-svetilnik-kendi-red
Подвесной светильник Moderli Martin-1,6790,https://www.divan.ru/product/podvesnoj-svetilnik-moderli-martin-1
Подвесной светильник Volare-1,4320,https://www.divan.ru/product/podvesnoj-svetilnik-volare-1
Подвесной светильник Milligan,5490,https://www.divan.ru/product/podvesnoj-svetilnik-milligan
Подвесной светильник Tureis,3390,https://www.divan.ru/product/podvesnoj-svetilnik-tureis
Подвесной светильник Санти White,9690,https://www.divan.ru/product/podvesnoj-svetilnik-santi-white
Подвесной светильник Layham,19790,https://www.divan.ru/product/podvesnoj-svetilnik-layham
Подвесной светильник Townshend-4,15390,https://www.divan.ru/product/podvesnoj-svetilnik-townshend-4
Подвесной светильник Даклин Black,3890,https://www.divan.ru/product/podvesnoj-svetilnik-daklin-black
Подвесной светильник Chieveley,18690,https://www.divan.ru/product/podvesnoj-svetilnik-chieveley
Подвесной светильник Moderli Libre,5490,https://www.divan.ru/product/podvesnoj-svetilnik-moderli-libre
Подвесной светильник Moderli Arya-2,8390,https://www.divan.ru/product/podvesnoj-svetilnik-moderli-arya-2
Подвесной светильник Даклин Red,3890,https://www.divan.ru/product/podvesnoj-svetilnik-daklin-red
Подвесной светильник Narices,9290,https://www.divan.ru/product/podvesnoj-svetilnik-narices
Подвесной светильник Moderli Brizzi-2,7790,https://www.divan.ru/product/podvesnoj-svetilnik-moderli-brizzi-2
Подвесной светильник Moderli Lewes,14390,https://www.divan.ru/product/podvesnoj-svetilnik-moderli-lewes
Подвесной светильник Milligan-1,16490,https://www.divan.ru/product/podvesnoj-svetilnik-milligan-1
Подвесной светильник Narices-1,26390,https://www.divan.ru/product/podvesnoj-svetilnik-narices-1
Подвесной светильник Нести White,5890,https://www.divan.ru/product/podvesnoj-svetilnik-nesti-white
Подвесной светильник Moderli Host-2,13690,https://www.divan.ru/product/podvesnoj-svetilnik-moderli-host-2
Подвесной светильник Moderli Zoe-2,8690,https://www.divan.ru/product/podvesnoj-svetilnik-moderli-zoe-2
Подвесной светильник Нести Black,5990,https://www.divan.ru/product/podvesnoj-svetilnik-nesti-black
Подвесной светильник Снэки-1 Grey,2490,https://www.divan.ru/product/podvesnoj-svetilnik-sneki-1-grey
Подвесной светильник Минки-1 Black,2790,https://www.divan.ru/product/podvesnoj-svetilnik-minki-1-black
Подвесной светильник Пайн-1 Black,2790,https://www.divan.ru/product/podvesnoj-svetilnik-pajn-1-black
Подвесной светильник Дейл Brown,2890,https://www.divan.ru/product/podvesnoj-svetilnik-dejl-brown
Подвесной светильник Альби Black,990,https://www.divan.ru/product/podvesnoj-svetilnik-albi-black
Подвесной светильник Volare,3990,https://www.divan.ru/product/podvesnoj-svetilnik-volare
Подвесной светильник Moderli Martin-2,14990,https://www.divan.ru/product/podvesnoj-svetilnik-moderli-martin-2
Подвесной светильник Moderli Host-1,6790,https://www.divan.ru/product/podvesnoj-svetilnik-moderli-host-1
Подвесной светильник Вьено-5 Black,12390,https://www.divan.ru/product/podvesnoj-svetilnik-veno-5-black
Подвесной светильник Ридж White,2990,https://www.divan.ru/product/podvesnoj-svetilnik-ridj-white
Подвесной светильник Минки-2 Black,3090,https://www.divan.ru/product/podvesnoj-svetilnik-minki-2-black
Подвесной светильник Хоул Brown,2990,https://www.divan.ru/product/podvesnoj-svetilnik-houl-brown
Подвесной светильник Мирра White,5090,https://www.divan.ru/product/podvesnoj-svetilnik-mirra-white
Подвесной светильник Мирра-1 White,5090,https://www.divan.ru/product/podvesnoj-svetilnik-mirra-1-white
Подвесной светильник Санти Black,12390,https://www.divan.ru/product/podvesnoj-svetilnik-santi-black
Подвесной светильник Кэнди Blue,6990,https://www.divan.ru/product/podvesnoj-svetilnik-kendi-blue
Подвесной светильник Кэнди Yellow,6990,https://www.divan.ru/product/podvesnoj-svetilnik-kendi-yellow
Подвесной светильник Кэнди Orange,6990,https://www.divan.ru/product/podvesnoj-svetilnik-kendi-orange
Подвесной светильник Хоул Grey,3690,https://www.divan.ru/product/podvesnoj-svetilnik-houl-grey
Подвесной светильник Минки Grey,2590,https://www.divan.ru/product/podvesnoj-svetilnik-minki-grey
Подвесной светильник Минки-1 Brown,2990,https://www.divan.ru/product/podvesnoj-svetilnik-minki-1-brown
Подвесной светильник Минки-2 Brown,3290,https://www.divan.ru/product/podvesnoj-svetilnik-minki-2-brown
Подвесной светильник Фолс White,4990,https://www.divan.ru/product/podvesnoj-svetilnik-fols-white
Подвесной светильник Телос White,2890,https://www.divan.ru/product/podvesnoj-svetilnik-telos-white
Подвесной светильник Пайн Black,2590,https://www.divan.ru/product/podvesnoj-svetilnik-pajn-black
Подвесной светильник Минки Black,2590,https://www.divan.ru/product/podvesnoj-svetilnik-minki-black
Подвесной светильник Снэки Grey,4390,https://www.divan.ru/product/podvesnoj-svetilnik-sneki-grey
Подвесной светильник Пайн-2 Black,3090,https://www.divan.ru/product/podvesnoj-svetilnik-pajn-2-black
Подвесной светильник Эффи Grafit,3790,https://www.divan.ru/product/podvesnoj-svetilnik-effi-grafit
Подвесной светильник Дейл-3 Brown,7890,https://www.divan.ru/product/podvesnoj-svetilnik-dejl-3-brown
Подвесной светильник Moderli Lia-2,5590,https://www.divan.ru/product/podvesnoj-svetilnik-moderli-lia-2
Подвесной светильник Минки White,2590,https://www.divan.ru/product/podvesnoj-svetilnik-minki-white
Подвесной светильник Пиллар-3 Black,4690,https://www.divan.ru/product/podvesnoj-svetilnik-pillar-3-black
Подвесной светильник Эллис-1 Black,2090,https://www.divan.ru/product/podvesnoj-svetilnik-ellis-1-black
Подвесной светильник Паоли-3 Black,6090,https://www.divan.ru/product/podvesnoj-svetilnik-paoli-3-black
Подвесной светильник Эллис-3 Black,5290,https://www.divan.ru/product/podvesnoj-svetilnik-ellis-3-black
Подвесной светильник Минки Brown,2690,https://www.divan.ru/product/podvesnoj-svetilnik-minki-brown
Подвесной светильник Фаро-3 White,6490,https://www.divan.ru/product/podvesnoj-svetilnik-faro-3-white
Подвесной светильник Лайонс White,8700,https://www.divan.ru/product/podvesnoj-svetilnik-lajons-white
Подвесной светильник Лайонс Black,8700,https://www.divan.ru/product/podvesnoj-svetilnik-lajons-black
Подвесной светильник Лима Grafit,2390,https://www.divan.ru/product/podvesnoj-svetilnik-lima-grafit
Подвесной светильник Паоли White,2290,https://www.divan.ru/product/podvesnoj-svetilnik-paoli-white
Подвесной светильник Хоул White,2990,https://www.divan.ru/product/podvesnoj-svetilnik-houl-white
Подвесной светильник Снэки-3 Grey,4700,https://www.divan.ru/product/podvesnoj-svetilnik-sneki-3-grey
Подвесной светильник Лиму-3 Black,5390,https://www.divan.ru/product/podvesnoj-svetilnik-limu-3-black
Подвесной светильник Фаро-1 White,3690,https://www.divan.ru/product/podvesnoj-svetilnik-faro-1-white
Подвесной светильник Атрани Black,4890,https://www.divan.ru/product/podvesnoj-svetilnik-atrani-black
Подвесной светильник Мистеро Black,1190,https://www.divan.ru/product/podvesnoj-svetilnik-mistero-black
Подвесной светильник Мистеро Grey,1190,https://www.divan.ru/product/podvesnoj-svetilnik-mistero-grey
Подвесной светильник Мистеро White,1190,https://www.divan.ru/product/podvesnoj-svetilnik-mistero-white
Подвесной светильник Ройл Black,6790,https://www.divan.ru/product/podvesnoj-svetilnik-rojl-black
Подвесной светильник Талли Black,6790,https://www.divan.ru/product/podvesnoj-svetilnik-talli-black
